{
  "schema_version": "tushare_endpoint_preflight_v2",
  "registry_version": "tushare_endpoint_registry_v2",
  "generated_at": "2026-08-08T17:32:03+00:00",
  "checks": [
    {
      "endpoint": "eco_cal",
      "status": "ACTIVE_VERIFIED",
      "permission_checked_at": "2026-07-19T12:22:49+00:00",
      "permission_evidence_id": "tushare-live-coverage-probe:eco_cal:2026-07-19T12:22:49+00:00",
      "schema_contract_version": "eco_cal_local_capture_pit_v2",
      "request_contract": {
        "date": "2020-04-10",
        "routes": [
          [
            "CNY",
            "中国"
          ],
          [
            "USD",
            "美国"
          ],
          [
            "EUR",
            "欧元区"
          ],
          [
            "BGN",
            "保加利亚"
          ],
          [
            "CZK",
            "捷克"
          ],
          [
            "DKK",
            "丹麦"
          ],
          [
            "HUF",
            "匈牙利"
          ],
          [
            "PLN",
            "波兰"
          ],
          [
            "RON",
            "罗马尼亚"
          ],
          [
            "SEK",
            "瑞典"
          ]
        ],
        "routing": "EXACT_DATE_DOCUMENTED_COUNTRY_WITH_EXPECTED_CURRENCY"
      },
      "expected_columns": [
        "date",
        "time",
        "currency",
        "country",
        "event",
        "value",
        "pre_value",
        "fore_value"
      ],
      "observed_row_count": 54,
      "permission_result": "NON_EMPTY_RESPONSE",
      "pit_assessment": "LOCAL_CAPTURE_ONLY",
      "raw_payload_committed": false,
      "response_content_hash": "sha256:28db4b26ebb608626767834e8072298bf5b3cc49f43d52c3770a502df14cac5e",
      "permission_error_class": null,
      "coverage_smoke": {
        "scope_kind": "EXACT_DATE_CURRENCY_COVERAGE",
        "date": "2020-04-10",
        "registered_currency_count": 10,
        "query_count": 10,
        "raw_row_count": 54,
        "deduplicated_row_count": 53,
        "truncated_leaf_count": 0,
        "status": "COMPLETE"
      }
    },
    {
      "endpoint": "cn_pmi",
      "status": "PRECHECK_REQUIRED",
      "permission_checked_at": "2026-07-17T08:18:03+00:00",
      "permission_evidence_id": "tushare-live-probe:cn_pmi:2026-07-17T08:18:03+00:00",
      "schema_contract_version": "tushare_cn_pmi_observed_schema_v1",
      "request_contract": {},
      "expected_columns": [
        "PMI010503",
        "PMI011300",
        "PMI020401",
        "PMI021000",
        "PMI010501",
        "PMI010600",
        "PMI010701",
        "PMI011900",
        "PMI020102",
        "PMI020202",
        "PMI020300",
        "PMI011400",
        "PMI012000",
        "PMI020700",
        "PMI020800",
        "PMI010703",
        "PMI011500",
        "PMI020101",
        "PMI020501",
        "PMI010400",
        "PMI010402",
        "PMI011200",
        "PMI011700",
        "PMI010502",
        "PMI020400",
        "PMI030000",
        "PMI010401",
        "PMI010900",
        "PMI020301",
        "PMI020900",
        "PMI010800",
        "PMI011800",
        "PMI020100",
        "PMI010000",
        "PMI010300",
        "PMI010603",
        "PMI010802",
        "PMI020200",
        "PMI020201",
        "PMI020601",
        "UPDATE_BY",
        "PMI010403",
        "PMI011000",
        "PMI020600",
        "CREATE_TIME",
        "PMI010200",
        "PMI010601",
        "PMI010702",
        "PMI020402",
        "PMI020502",
        "CREATE_BY",
        "ID",
        "MONTH",
        "PMI011100",
        "PMI020302",
        "PMI010100",
        "PMI010500",
        "PMI010602",
        "PMI010803",
        "PMI020602",
        "PMI010700",
        "PMI010801",
        "PMI011600",
        "PMI020500",
        "UPDATE_TIME"
      ],
      "observed_row_count": 258,
      "permission_result": "NON_EMPTY_RESPONSE",
      "pit_assessment": "LOCAL_CAPTURE_ONLY",
      "raw_payload_committed": false,
      "response_content_hash": "sha256:0d9783e2d27aee576749e954bfddc2b9d140d646dc9aa0106e4b4b7c906928a5",
      "permission_error_class": null,
      "coverage_smoke": {
        "scope_kind": "PERMISSION_SCHEMA_SAMPLE",
        "date": "2026-07-17",
        "registered_currency_count": 0,
        "query_count": 1,
        "raw_row_count": 258,
        "deduplicated_row_count": 258,
        "truncated_leaf_count": 0,
        "status": "PERMISSION_SCHEMA_ONLY"
      }
    },
    {
      "endpoint": "cn_gdp",
      "status": "PRECHECK_REQUIRED",
      "permission_checked_at": "2026-07-17T08:18:03+00:00",
      "permission_evidence_id": "tushare-live-probe:cn_gdp:2026-07-17T08:18:03+00:00",
      "schema_contract_version": "tushare_cn_gdp_observed_schema_v1",
      "request_contract": {},
      "expected_columns": [
        "quarter",
        "gdp",
        "gdp_yoy",
        "pi",
        "pi_yoy",
        "si",
        "si_yoy",
        "ti",
        "ti_yoy"
      ],
      "observed_row_count": 177,
      "permission_result": "NON_EMPTY_RESPONSE",
      "pit_assessment": "LOCAL_CAPTURE_ONLY",
      "raw_payload_committed": false,
      "response_content_hash": "sha256:9c4284681b36f7b630aeb60a8998a4945e0e8585781e79ebc2685c95c4919aa6",
      "permission_error_class": null,
      "coverage_smoke": {
        "scope_kind": "PERMISSION_SCHEMA_SAMPLE",
        "date": "2026-07-17",
        "registered_currency_count": 0,
        "query_count": 1,
        "raw_row_count": 177,
        "deduplicated_row_count": 177,
        "truncated_leaf_count": 0,
        "status": "PERMISSION_SCHEMA_ONLY"
      }
    },
    {
      "endpoint": "cn_cpi",
      "status": "PRECHECK_REQUIRED",
      "permission_checked_at": "2026-07-17T08:18:03+00:00",
      "permission_evidence_id": "tushare-live-probe:cn_cpi:2026-07-17T08:18:03+00:00",
      "schema_contract_version": "tushare_cn_cpi_observed_schema_v1",
      "request_contract": {},
      "expected_columns": [
        "month",
        "nt_val",
        "nt_yoy",
        "nt_mom",
        "nt_accu",
        "town_val",
        "town_yoy",
        "town_mom",
        "town_accu",
        "cnt_val",
        "cnt_yoy",
        "cnt_mom",
        "cnt_accu"
      ],
      "observed_row_count": 510,
      "permission_result": "NON_EMPTY_RESPONSE",
      "pit_assessment": "LOCAL_CAPTURE_ONLY",
      "raw_payload_committed": false,
      "response_content_hash": "sha256:af4226f9b15b9793a08925f37059447f75f271767b70878c6fef08c3011d9145",
      "permission_error_class": null,
      "coverage_smoke": {
        "scope_kind": "PERMISSION_SCHEMA_SAMPLE",
        "date": "2026-07-17",
        "registered_currency_count": 0,
        "query_count": 1,
        "raw_row_count": 510,
        "deduplicated_row_count": 510,
        "truncated_leaf_count": 0,
        "status": "PERMISSION_SCHEMA_ONLY"
      }
    },
    {
      "endpoint": "cn_ppi",
      "status": "PRECHECK_REQUIRED",
      "permission_checked_at": "2026-07-17T08:18:03+00:00",
      "permission_evidence_id": "tushare-live-probe:cn_ppi:2026-07-17T08:18:03+00:00",
      "schema_contract_version": "tushare_cn_ppi_observed_schema_v1",
      "request_contract": {},
      "expected_columns": [
        "month",
        "ppi_yoy",
        "ppi_mp_yoy",
        "ppi_mp_qm_yoy",
        "ppi_mp_rm_yoy",
        "ppi_mp_p_yoy",
        "ppi_cg_yoy",
        "ppi_cg_f_yoy",
        "ppi_cg_c_yoy",
        "ppi_cg_adu_yoy",
        "ppi_cg_dcg_yoy",
        "ppi_mom",
        "ppi_mp_mom",
        "ppi_mp_qm_mom",
        "ppi_mp_rm_mom",
        "ppi_mp_p_mom",
        "ppi_cg_mom",
        "ppi_cg_f_mom",
        "ppi_cg_c_mom",
        "ppi_cg_adu_mom",
        "ppi_cg_dcg_mom",
        "ppi_accu",
        "ppi_mp_accu",
        "ppi_mp_qm_accu",
        "ppi_mp_rm_accu",
        "ppi_mp_p_accu",
        "ppi_cg_accu",
        "ppi_cg_f_accu",
        "ppi_cg_c_accu",
        "ppi_cg_adu_accu",
        "ppi_cg_dcg_accu"
      ],
      "observed_row_count": 417,
      "permission_result": "NON_EMPTY_RESPONSE",
      "pit_assessment": "LOCAL_CAPTURE_ONLY",
      "raw_payload_committed": false,
      "response_content_hash": "sha256:8fce516f663cb07d61d7ffbafa709a4d9d11b09e7a64fda0f6d3556fe84c4356",
      "permission_error_class": null,
      "coverage_smoke": {
        "scope_kind": "PERMISSION_SCHEMA_SAMPLE",
        "date": "2026-07-17",
        "registered_currency_count": 0,
        "query_count": 1,
        "raw_row_count": 417,
        "deduplicated_row_count": 417,
        "truncated_leaf_count": 0,
        "status": "PERMISSION_SCHEMA_ONLY"
      }
    },
    {
      "endpoint": "shibor",
      "status": "PRECHECK_REQUIRED",
      "permission_checked_at": "2026-07-17T08:18:03+00:00",
      "permission_evidence_id": "tushare-live-probe:shibor:2026-07-17T08:18:03+00:00",
      "schema_contract_version": "tushare_shibor_observed_schema_v1",
      "request_contract": {
        "start_date": "20260701",
        "end_date": "20260717"
      },
      "expected_columns": [
        "date",
        "on",
        "1w",
        "2w",
        "1m",
        "3m",
        "6m",
        "9m",
        "1y"
      ],
      "observed_row_count": 13,
      "permission_result": "NON_EMPTY_RESPONSE",
      "pit_assessment": "LOCAL_CAPTURE_ONLY",
      "raw_payload_committed": false,
      "response_content_hash": "sha256:af635e501fa8a6f5fd217642b03c3b20d6b79dd4ed637e4b4e107e087df69a75",
      "permission_error_class": null,
      "coverage_smoke": {
        "scope_kind": "PERMISSION_SCHEMA_SAMPLE",
        "date": "2026-07-17",
        "registered_currency_count": 0,
        "query_count": 1,
        "raw_row_count": 13,
        "deduplicated_row_count": 13,
        "truncated_leaf_count": 0,
        "status": "PERMISSION_SCHEMA_ONLY"
      }
    },
    {
      "endpoint": "shibor_quote",
      "status": "PRECHECK_REQUIRED",
      "permission_checked_at": "2026-07-17T08:18:03+00:00",
      "permission_evidence_id": "tushare-live-probe:shibor_quote:2026-07-17T08:18:03+00:00",